{
  "$schema": "../../../.schema/v1/seed.json",
  "kind": "seed",
  "id": "01JVSS00000000000000000004",
  "name": "partners",
  "target": "01JVSR00000000000000000003",
  "columns": [
    "01JVSR00000000000000000031",
    "01JVSR00000000000000000032"
  ],
  "rows": [
    { "id": "01JVSS00000000000000000041", "values": ["01JVSS00000000000000000031", "01JVSS00000000000000000032"] },
    { "id": "01JVSS00000000000000000042", "values": ["01JVSS00000000000000000031"] }
  ]
}
