{
  "$schema": "../../../.schema/v1/seed.json",
  "kind": "seed",
  "id": "01JVSS00000000000000000003",
  "name": "City",
  "target": "01JVSE00000000000000000003",
  "columns": [
    "01JVSE00000000000000000032",
    "01JVSE00000000000000000033",
    "01JVSR00000000000000000012",
    "01JVSR00000000000000000022",
    "01JVSR00000000000000000032"
  ],
  "rows": [
    { "id": "01JVSS00000000000000000031", "values": ["Paris", 2100000, "01JVSS00000000000000000021"] },
    { "id": "01JVSS00000000000000000032", "values": ["Lyon", "many", "01JVSS00000000000000000099"] },
    { "id": "01JVSS00000000000000000033", "values": [null, 5] }
  ]
}
